Enter password: ****
Welcome to the MySQL monitor.  Commands end with ; or \g.
Your MySQL connection id is 23
Server version: 8.0.21 MySQL Community Server - GPL

Copyright (c) 2000, 2020, Oracle and/or its affiliates. All rights reserved.

Oracle is a registered trademark of Oracle Corporation and/or its
affiliates. Other names may be trademarks of their respective
owners.

Type 'help;' or '\h' for help. Type '\c' to clear the current input statement.


mysql> use university;
Database changed
mysql> create view v5 *******For 2 tables********
    -> as select inst_name, course_id
    -> from instructor, teaches
    -> where instructor.inst_id=teaches.inst_id;
Query OK, 0 rows affected (0.26 sec)

mysql> select * from v5;
+-----------+-----------+
| inst_name | course_id |
+-----------+-----------+
| STU       | Bio-1     |
| EFG       | Phy-2     |
| ABC       | CS-2      |
| STU       | Bio-2     |
| LMN       | Mu-1      |
+-----------+-----------+
5 rows in set (0.10 sec)

mysql> select inst_name, course_id
    -> from instructor, teaches
    -> where instructor.inst_id=teaches.inst_id;
+-----------+-----------+
| inst_name | course_id |
+-----------+-----------+
| ABC       | CS-2      |
| EFG       | Phy-2     |
| LMN       | Mu-1      |
| STU       | Bio-1     |
| STU       | Bio-2     |
+-----------+-----------+
5 rows in set (0.13 sec)


mysql> insert into v5 (inst_name, course_id) values ('PQR', 'Music');
ERROR 1393 (HY000): Can not modify more than one base table through a join view 'university.v5'
mysql> select * instructor;
ERROR 1064 (42000): You have an error in your SQL syntax; check the manual that corresponds to your MySQL server version for the right syntax to use near 'instructor' at line 1

















mysql> select * from instructor;
+---------+-----------+--------+-----------+
| inst_id | inst_name | salary | dept_name |
+---------+-----------+--------+-----------+
|     111 | ABC       |  85000 | Computer  |
|     112 | PQR       | 110000 | Music     |
|     113 | EFG       |  90000 | Physics   |
|     114 | XYZ       |  80000 | History   |
|     115 | LMN       | 110000 | Music     |
|     116 | UVW       |  90000 | Physics   |
|     117 | STU       |  85000 | Biology   |
+---------+-----------+--------+-----------+
7 rows in set (0.00 sec)

mysql> update instructor set inst_name='GRE' where dept_name='Biology';
Query OK, 1 row affected (0.20 sec)
Rows matched: 1  Changed: 1  Warnings: 0

mysql> select * from instructor;
+---------+-----------+--------+-----------+
| inst_id | inst_name | salary | dept_name |
+---------+-----------+--------+-----------+
|     111 | ABC       |  85000 | Computer  |
|     112 | PQR       | 110000 | Music     |
|     113 | EFG       |  90000 | Physics   |
|     114 | XYZ       |  80000 | History   |
|     115 | LMN       | 110000 | Music     |
|     116 | UVW       |  90000 | Physics   |
|     117 | GRE       |  85000 | Biology   |
+---------+-----------+--------+-----------+
7 rows in set (0.00 sec)


mysql> select * from v5;
+-----------+-----------+
| inst_name | course_id |
+-----------+-----------+
| GRE       | Bio-1     |
| EFG       | Phy-2     |
| ABC       | CS-2      |
| GRE       | Bio-2     |
| LMN       | Mu-1      |
+-----------+-----------+
5 rows in set (0.00 sec)























mysql> update v5 set inst_name='HIJ' where course_id='Bio-1';
Query OK, 1 row affected (0.17 sec)
Rows matched: 1  Changed: 1  Warnings: 0

mysql> select * from v5;
+-----------+-----------+
| inst_name | course_id |
+-----------+-----------+
| ABC       | CS-2      |
| EFG       | Phy-2     |
| LMN       | Mu-1      |
| HIJ       | Bio-1     |
| HIJ       | Bio-2     |
+-----------+-----------+
5 rows in set (0.11 sec)

mysql> select * from instructor;
+---------+-----------+--------+-----------+
| inst_id | inst_name | salary | dept_name |
+---------+-----------+--------+-----------+
|     111 | ABC       |  85000 | Computer  |
|     112 | PQR       | 110000 | Music     |
|     113 | EFG       |  90000 | Physics   |
|     114 | XYZ       |  80000 | History   |
|     115 | LMN       | 110000 | Music     |
|     116 | UVW       |  90000 | Physics   |
|     117 | HIJ       |  85000 | Biology   |
+---------+-----------+--------+-----------+
7 rows in set (0.00 sec)





















mysql> delete from v5 where course_id='Bio-1';
ERROR 1395 (HY000): Can not delete from join view 'university.v5'
mysql> delete from v5 where inst_name='ABC';
ERROR 1395 (HY000): Can not delete from join view 'university.v5'






















mysql> select * from instructor;
+---------+-----------+--------+-----------+
| inst_id | inst_name | salary | dept_name |
+---------+-----------+--------+-----------+
|     111 | ABC       |  85000 | Computer  |
|     112 | PQR       | 110000 | Music     |
|     113 | EFG       |  90000 | Physics   |
|     114 | XYZ       |  80000 | History   |
|     115 | LMN       | 110000 | Music     |
|     116 | UVW       |  90000 | Physics   |
|     117 | HIJ       |  85000 | Biology   |
+---------+-----------+--------+-----------+
7 rows in set (0.00 sec)

mysql> delete from v5 where course_id='Bio-1';
ERROR 1395 (HY000): Can not delete from join view 'university.v5'
mysql> delete from v5 where inst_name='ABC';
ERROR 1395 (HY000): Can not delete from join view 'university.v5'
mysql> select * from teaches;
+---------+-----------+--------+----------+------+
| inst_id | course_id | sec_id | semester | year |
+---------+-----------+--------+----------+------+
|     117 | Bio-1     | s11    | I        | FY   |
|     113 | Phy-2     | s12    | II       | FY   |
|     111 | CS-2      | s13    | II       | SY   |
|     117 | Bio-2     | s11    | I        | FY   |
|     115 | Mu-1      | s14    | II       | TY   |
+---------+-----------+--------+----------+------+
5 rows in set (0.00 sec)

mysql> delete from instructor where inst_name='HIJ';
ERROR 1451 (23000): Cannot delete or update a parent row: a foreign key constraint fails (`university`.`teaches`, CONSTRAINT `teaches_ibfk_1` FOREIGN KEY (`inst_id`) REFERENCES `instructor` (`inst_id`))
mysql> delete from instructor where dept_name='Biology';
ERROR 1451 (23000): Cannot delete or update a parent row: a foreign key constraint fails (`university`.`teaches`, CONSTRAINT `teaches_ibfk_1` FOREIGN KEY (`inst_id`) REFERENCES `instructor` (`inst_id`))
mysql> delete from instructor where inst_id=117;
ERROR 1451 (23000): Cannot delete or update a parent row: a foreign key constraint fails (`university`.`teaches`, CONSTRAINT `teaches_ibfk_1` FOREIGN KEY (`inst_id`) REFERENCES `instructor` (`inst_id`))
mysql>











































